{"checks":[{"id":"f-engine","label":"engine file present","path":"verdict.js","type":"file_exists"},{"id":"f-cli","label":"CLI present","path":"cli/verify.js","type":"file_exists"},{"id":"f-ui","label":"UI page present","path":"index.html","type":"file_exists"},{"id":"f-tests","label":"test suite present","path":"tests/test.js","type":"file_exists"},{"id":"f-readme","label":"README present","path":"README.md","type":"file_exists"},{"id":"t-count","label":"at least 30 real tests","min":30,"path":"tests/test.js","pattern":"test\\('","type":"count_match"},{"equals":"node --test tests/test.js","field":"scripts.test","id":"t-script","label":"npm test runs the real suite","path":"package.json","type":"json_field"},{"id":"r-schema","label":"README documents the manifest schema","path":"README.md","pattern":"cwi\\.task-verdict/1\\.0","type":"file_regex"}],"claim":"Task Verdict #39 ships with engine, CLI, UI, docs, and a real test suite","claimed_by":"KingCode (CWI_Results dogfood)","schema":"cwi.task-verdict/1.0","task_id":"tv_dogfood_self_local_20260916","title":"Dogfood: Task Verdict's own ship checklist (local files)"}